<?xml version="1.0" encoding="UTF-8"?>
<Employees xmlns:xsi="http://www.w3.org/2001/XMLSchema-instance"
    xsi:noNamespaceSchemaLocation="Q6.XSD">
    <Employee>
        <EmployeeNumber>A-84</EmployeeNumber>
        <Name>Pujan</Name>
        <Designation>Software Engineer</Designation>
        <Salary>80000.00</Salary>
    </Employee>
    <Employee>
        <EmployeeNumber>A-83</EmployeeNumber>
        <Name>Trushal</Name>
        <Designation>Marketing Manager</Designation>
        <Salary>95000.00</Salary>
    </Employee>
</Employees>